{
    "$schema": "./grpc-boot.schema.json",
    "package": "services",
    "protoDirs": [
        "services"
    ],
    "protoOptions": {
        "longs": "String",
        "defaults": true,
        "oneofs": true
    },
    "apps": [
        {
            "name": "example-server",
            "uri": "grpc://localhost:4000",
            "serve": true,
            "services": [
                "services.ExampleService"
            ],
            "stdout": "./out.log"
        },
        {
            "name": "user-server",
            "uri": "grpc://localhost:4001",
            "serve": false,
            "services": [
                "services.UserService"
            ]
        },
        {
            "name": "post-server",
            "uri": "grpcs://localhost:4002",
            "serve": true,
            "services": [
                "services.PostService"
            ],
            "stdout": "./out.log",
            "ca": "./certs/ca.pem",
            "cert": "./certs/cert.pem",
            "key": "./certs/cert.key"
        }
    ]
}
